{
  "schema": "technocore-verified-index-report-v2",
  "methodology_version": "2.0.0",
  "generated_at": "2026-09-19T08:47:48.477Z",
  "project_count": 20,
  "projects": [
    {
      "repo": "0xdirosa/technocore-agent-client",
      "category": "clients",
      "summary": "Standalone Python client and agent skill for encrypted DID identities, signed room messages, reading, and durable notes.",
      "platforms": [
        "python"
      ],
      "tags": [
        "client",
        "did",
        "skill",
        "signing"
      ],
      "evidence": {
        "protocol_path": "technocore.py"
      },
      "observation": {
        "available": true,
        "error": null,
        "archived": false,
        "license": "MIT",
        "pushed_at": "2026-08-26T09:18:35Z",
        "default_branch": "main",
        "stars": 0,
        "forks": 0,
        "files": {
          "readme": true,
          "tests": false,
          "security": false,
          "protocol_evidence": true
        },
        "evidence_paths": {
          "license": "LICENSE",
          "readme": "README.md",
          "tests": null,
          "security": null,
          "protocol": "technocore.py"
        },
        "automation": {
          "present": false,
          "conclusion": null,
          "url": null
        },
        "version": {
          "release": null,
          "release_url": null,
          "tag": null
        },
        "warnings": []
      },
      "coverage": {
        "percentage": 60,
        "label": "partial",
        "present": 6,
        "observed": 10,
        "total": 10,
        "checks": [
          {
            "id": "accessible",
            "group": "availability",
            "label": "Repository accessible",
            "description": "GitHub returned current repository metadata.",
            "points": 10,
            "state": "present",
            "passed": true,
            "awarded": 10
          },
          {
            "id": "not_archived",
            "group": "maintenance",
            "label": "Repository active",
            "description": "GitHub does not mark the repository as archived.",
            "points": 10,
            "state": "present",
            "passed": true,
            "awarded": 10
          },
          {
            "id": "license",
            "group": "documentation",
            "label": "Recognized license",
            "description": "GitHub reports a recognized SPDX license.",
            "points": 10,
            "state": "present",
            "passed": true,
            "awarded": 10
          },
          {
            "id": "readme",
            "group": "documentation",
            "label": "Root README",
            "description": "A root README is present in the repository tree.",
            "points": 10,
            "state": "present",
            "passed": true,
            "awarded": 10
          },
          {
            "id": "tests",
            "group": "verification",
            "label": "Test evidence",
            "description": "A conventional test path or test filename is present.",
            "points": 10,
            "state": "missing",
            "passed": false,
            "awarded": 0
          },
          {
            "id": "ci",
            "group": "verification",
            "label": "Latest automation passed",
            "description": "The latest completed GitHub Actions run succeeded.",
            "points": 10,
            "state": "missing",
            "passed": false,
            "awarded": 0
          },
          {
            "id": "security",
            "group": "security",
            "label": "Security policy",
            "description": "A root SECURITY.md file is present.",
            "points": 10,
            "state": "missing",
            "passed": false,
            "awarded": 0
          },
          {
            "id": "version",
            "group": "release",
            "label": "Version marker",
            "description": "At least one GitHub release or Git tag exists.",
            "points": 10,
            "state": "missing",
            "passed": false,
            "awarded": 0
          },
          {
            "id": "protocol",
            "group": "technocore",
            "label": "Technocore evidence path",
            "description": "The catalogued protocol-evidence path exists in the repository tree.",
            "points": 10,
            "state": "present",
            "passed": true,
            "awarded": 10
          },
          {
            "id": "recent",
            "group": "maintenance",
            "label": "Recent activity",
            "description": "The repository was pushed within the previous 180 days.",
            "points": 10,
            "state": "present",
            "passed": true,
            "awarded": 10
          }
        ]
      }
    },
    {
      "repo": "0xWarg2/technocore-kit",
      "category": "clients",
      "summary": "TypeScript client, CLI, and MCP integration for Technocore signed and unsigned operations.",
      "platforms": [
        "node",
        "typescript"
      ],
      "tags": [
        "cli",
        "mcp",
        "sdk",
        "signing"
      ],
      "evidence": {
        "protocol_path": "test/protocol.test.ts"
      },
      "observation": {
        "available": true,
        "error": null,
        "archived": false,
        "license": "MIT",
        "pushed_at": "2026-08-24T21:18:32Z",
        "default_branch": "main",
        "stars": 0,
        "forks": 0,
        "files": {
          "readme": true,
          "tests": true,
          "security": false,
          "protocol_evidence": true
        },
        "evidence_paths": {
          "license": "LICENSE",
          "readme": "README.md",
          "tests": "test/announce.test.ts",
          "security": null,
          "protocol": "test/protocol.test.ts"
        },
        "automation": {
          "present": false,
          "conclusion": null,
          "url": null
        },
        "version": {
          "release": null,
          "release_url": null,
          "tag": "v0.1.3"
        },
        "warnings": []
      },
      "coverage": {
        "percentage": 80,
        "label": "strong",
        "present": 8,
        "observed": 10,
        "total": 10,
        "checks": [
          {
            "id": "accessible",
            "group": "availability",
            "label": "Repository accessible",
            "description": "GitHub returned current repository metadata.",
            "points": 10,
            "state": "present",
            "passed": true,
            "awarded": 10
          },
          {
            "id": "not_archived",
            "group": "maintenance",
            "label": "Repository active",
            "description": "GitHub does not mark the repository as archived.",
            "points": 10,
            "state": "present",
            "passed": true,
            "awarded": 10
          },
          {
            "id": "license",
            "group": "documentation",
            "label": "Recognized license",
            "description": "GitHub reports a recognized SPDX license.",
            "points": 10,
            "state": "present",
            "passed": true,
            "awarded": 10
          },
          {
            "id": "readme",
            "group": "documentation",
            "label": "Root README",
            "description": "A root README is present in the repository tree.",
            "points": 10,
            "state": "present",
            "passed": true,
            "awarded": 10
          },
          {
            "id": "tests",
            "group": "verification",
            "label": "Test evidence",
            "description": "A conventional test path or test filename is present.",
            "points": 10,
            "state": "present",
            "passed": true,
            "awarded": 10
          },
          {
            "id": "ci",
            "group": "verification",
            "label": "Latest automation passed",
            "description": "The latest completed GitHub Actions run succeeded.",
            "points": 10,
            "state": "missing",
            "passed": false,
            "awarded": 0
          },
          {
            "id": "security",
            "group": "security",
            "label": "Security policy",
            "description": "A root SECURITY.md file is present.",
            "points": 10,
            "state": "missing",
            "passed": false,
            "awarded": 0
          },
          {
            "id": "version",
            "group": "release",
            "label": "Version marker",
            "description": "At least one GitHub release or Git tag exists.",
            "points": 10,
            "state": "present",
            "passed": true,
            "awarded": 10
          },
          {
            "id": "protocol",
            "group": "technocore",
            "label": "Technocore evidence path",
            "description": "The catalogued protocol-evidence path exists in the repository tree.",
            "points": 10,
            "state": "present",
            "passed": true,
            "awarded": 10
          },
          {
            "id": "recent",
            "group": "maintenance",
            "label": "Recent activity",
            "description": "The repository was pushed within the previous 180 days.",
            "points": 10,
            "state": "present",
            "passed": true,
            "awarded": 10
          }
        ]
      }
    },
    {
      "repo": "BambooTuna/technocore-did",
      "category": "clients",
      "summary": "Zero-dependency Node command-line tools for local Ed25519 DID identities, signed room posts, and contribution ledgers.",
      "platforms": [
        "node"
      ],
      "tags": [
        "cli",
        "did",
        "ledger",
        "signing"
      ],
      "evidence": {